{"schema":1,"id":"airplay","name":"AirPlay","icon":"󰑈","description":"Receive AirPlay","packages":{"repo":["avahi"],"aur":["uxplay"]},"units":["delight-airplay.service"],"firewall":[{"proto":"tcp","ports":"7000:7001"},{"proto":"udp","ports":"5353"}],"capabilities":["network"],"provides":{"shareTargets":true,"devices":true},"plugin":"plugin","menu":[{"id":"open","label":"AirPlay","icon":"󰑈","action":"delight airplay open"}],"hooks":["theme-set"]}
