{
  "schema": 1,
  "id": "phone",
  "name": "iPhone",
  "icon": "󰀷",
  "description": "Native iPhone link over Bluetooth LE: notifications with actions (ANCS) and media control (AMS). No iPhone app.",
  "packages": { "repo": ["bluez"], "aur": [] },
  "units": ["delight-phone.service"],
  "firewall": [],
  "capabilities": ["bluetooth"],
  "provides": { "shareTargets": false, "devices": true },
  "plugin": "plugin",
  "menu": [
    { "id": "open", "label": "iPhone", "action": "delight phone open" },
    { "id": "pair", "label": "Pair an iPhone", "action": "delight phone pair" },
    { "id": "media", "label": "Play/pause on iPhone", "action": "delight phone media toggle" },
    { "id": "toggle", "label": "Toggle iPhone link", "icon": "󰀷", "action": "delight phone toggle" }
  ]
}
